[
  {
    "alert_id": "1ZZEV01A300004585-1790803033000-HARSH_BRAKE",
    "vin": "1ZZEV01A300004585",
    "type": "HARSH_BRAKE",
    "severity": "INFO",
    "severity_level": 4,
    "event_ts": "2026-09-30T21:17:13Z",
    "emit_ts": "2026-09-30T21:17:22.94252888Z",
    "latency_ms": 9942.52888,
    "lat": 47.64934461253359,
    "lon": -122.2433238125159,
    "detail": {
      "evt": "HARSH_BRAKE",
      "speed_kmh": 32.5
    }
  },
  {
    "alert_id": "1ZZEV01A800005070-1790803033000-HARSH_BRAKE",
    "vin": "1ZZEV01A800005070",
    "type": "HARSH_BRAKE",
    "severity": "INFO",
    "severity_level": 4,
    "event_ts": "2026-09-30T21:17:13Z",
    "emit_ts": "2026-09-30T21:17:22.94352133Z",
    "latency_ms": 9943.52133,
    "lat": 47.66362092750011,
    "lon": -122.3823797053979,
    "detail": {
      "evt": "HARSH_BRAKE",
      "speed_kmh": 72.7
    }
  },
  {
    "alert_id": "1ZZEV01A000005385-1790803033000-HARSH_BRAKE",
    "vin": "1ZZEV01A000005385",
    "type": "HARSH_BRAKE",
    "severity": "INFO",
    "severity_level": 4,
    "event_ts": "2026-09-30T21:17:13Z",
    "emit_ts": "2026-09-30T21:17:22.943894671Z",
    "latency_ms": 9943.894671,
    "lat": 47.69757432113907,
    "lon": -122.36695259133519,
    "detail": {
      "evt": "HARSH_BRAKE",
      "speed_kmh": 46.5
    }
  },
  {
    "alert_id": "1VXEV01A100009331-1790803033000-HARSH_BRAKE",
    "vin": "1VXEV01A100009331",
    "type": "HARSH_BRAKE",
    "severity": "INFO",
    "severity_level": 4,
    "event_ts": "2026-09-30T21:17:13Z",
    "emit_ts": "2026-09-30T21:17:22.952316695Z",
    "latency_ms": 9952.316695,
    "lat": 37.70208510227171,
    "lon": -122.40398319800754,
    "detail": {
      "evt": "HARSH_BRAKE",
      "speed_kmh": 49.2
    }
  },
  {
    "alert_id": "1VXEV01A500012491-1790803033000-HARSH_BRAKE",
    "vin": "1VXEV01A500012491",
    "type": "HARSH_BRAKE",
    "severity": "INFO",
    "severity_level": 4,
    "event_ts": "2026-09-30T21:17:13Z",
    "emit_ts": "2026-09-30T21:17:22.958157664Z",
    "latency_ms": 9958.157664,
    "lat": 37.67125534396744,
    "lon": -122.4004629531088,
    "detail": {
      "evt": "HARSH_BRAKE",
      "speed_kmh": 0
    }
  },
  {
    "alert_id": "1NMEV01A100038437-1790803034000-HARSH_BRAKE",
    "vin": "1NMEV01A100038437",
    "type": "HARSH_BRAKE",
    "severity": "INFO",
    "severity_level": 4,
    "event_ts": "2026-09-30T21:17:14Z",
    "emit_ts": "2026-09-30T21:17:23.006848831Z",
    "latency_ms": 9006.848831,
    "lat": 34.08353948057553,
    "lon": -118.18860659493139,
    "detail": {
      "evt": "HARSH_BRAKE",
      "speed_kmh": 34.28
    }
  },
  {
    "alert_id": "1ADEV01A700039368-1790803034000-HARSH_BRAKE",
    "vin": "1ADEV01A700039368",
    "type": "HARSH_BRAKE",
    "severity": "INFO",
    "severity_level": 4,
    "event_ts": "2026-09-30T21:17:14Z",
    "emit_ts": "2026-09-30T21:17:23.0093829Z",
    "latency_ms": 9009.3829,
    "lat": 41.81311,
    "lon": -87.64925,
    "detail": {
      "evt": "HARSH_BRAKE",
      "speed_kmh": 30
    }
  },
  {
    "alert_id": "1NMEV01A300049942-1790803034000-HARSH_BRAKE",
    "vin": "1NMEV01A300049942",
    "type": "HARSH_BRAKE",
    "severity": "INFO",
    "severity_level": 4,
    "event_ts": "2026-09-30T21:17:14Z",
    "emit_ts": "2026-09-30T21:17:23.60629424Z",
    "latency_ms": 9606.294240000001,
    "lat": 33.978415329224006,
    "lon": -118.26120625776362,
    "detail": {
      "evt": "HARSH_BRAKE",
      "speed_kmh": 42.33
    }
  },
  {
    "alert_id": "1ZZEV01AX00050835-1790803034000-HARSH_BRAKE",
    "vin": "1ZZEV01AX00050835",
    "type": "HARSH_BRAKE",
    "severity": "INFO",
    "severity_level": 4,
    "event_ts": "2026-09-30T21:17:14Z",
    "emit_ts": "2026-09-30T21:17:23.608003737Z",
    "latency_ms": 9608.003737000001,
    "lat": 47.6666743758576,
    "lon": -122.40491321784296,
    "detail": {
      "evt": "HARSH_BRAKE",
      "speed_kmh": 73.2
    }
  },
  {
    "alert_id": "1VXEV01A700052586-1790803034000-HARSH_BRAKE",
    "vin": "1VXEV01A700052586",
    "type": "HARSH_BRAKE",
    "severity": "INFO",
    "severity_level": 4,
    "event_ts": "2026-09-30T21:17:14Z",
    "emit_ts": "2026-09-30T21:17:23.611617555Z",
    "latency_ms": 9611.617555,
    "lat": 37.84809811721823,
    "lon": -122.42033423573066,
    "detail": {
      "evt": "HARSH_BRAKE",
      "speed_kmh": 33.5
    }
  }
]